{"authoring":{"agent":"Codex large-model nightshift foreman","authority_basis":"Operator instruction /home/jbeck/autonomous-nightshift-codex-handoff-2026-08-29.md for this bounded run; this packet is not authority.","session":"autonomous-nightshift-convergence-2026-08-29"},"canonicalization":{"algorithm":"RFC8785-JCS","digest_algorithm":"SHA-256","digest_preimage":"domain prefix nightshift.orientation-packet.digest/v1 NUL, then packet object with packet_digest and switchyard.plan_ref omitted as RFC8785-JCS"},"created_at":"2026-08-29T17:00:00Z","current_until":"2026-08-30T12:00:00Z","global_constraints":{"allowed_actions":["read repository evidence","create isolated campaign worktrees or clones","edit only declared campaign surfaces","run local tests and authorized disposable fixtures","commit coherent campaign checkpoints","push campaign branches to established private remotes and verify SHA"],"forbidden_actions":["default-branch merge without an existing automatic promotion rule","production or live-route activation","approval response or protected side-effect self-approval","published-history rewrite","consumed occurrence replay","hidden rebuild or artifact substitution","live GLASSHOPPER mutation before its closeout boundary"],"invariants":["This packet is non-authorizing.","Track, campaign, occurrence, and result classification remain distinct.","Terminal predecessor results remain immutable.","Transport carries only registered alias, immutable plan_ref, nonce, and minimal mechanism metadata.","Authorization, native approval, Docket custody, execution, observation, and settlement remain separate."]},"human_question_criteria":["unavailable secret or protected approval","physical action or privileged-host capability","unauthorized production or default-branch mutation","genuinely missing provenance not reconstructible under an explicit campaign","two materially incompatible constitutional interpretations remaining after code, history, tests, and records"],"packet_digest":"sha256:01e9f695fd89af789023cea0b9220a8e5178f807066779c9f7a4b7b3b67d4ba7","packet_id":"nightshift-20260829-autonomous-convergence","repository_custody":[{"branch":"campaign/axolotl-design-custody-2026-08-27","commit":"9bdaae8587a2d6419c12d83ed136a4ee7da0a048","discrepancy":"Four pre-existing untracked files; separate campaign-constellation branch has sole local commit 48255df101670ae43514b2b1475aeb8900195c8b.","path":"/data/git/cartography","remote":"origin","remote_commit":"9bdaae8587a2d6419c12d83ed136a4ee7da0a048","repository":"cartography","worktree_clean":false},{"branch":"campaign/governed-campaign-loop-v0-qualification","commit":"999a91d92b56e655906a31a1a4e914ccaf1ecbfb","discrepancy":"Seven predecessor commits were sole-local at run entry; successor branch push must custody them.","path":"/data/git/nightshift","remote":"origin","remote_commit":null,"repository":"nightshift","worktree_clean":true},{"branch":"master","commit":"3f719451f2daca88bdb4e87e8e8142f22cc9df7d","discrepancy":"Configured local-bundle origin is absent; no authoritative forge destination is registered.","path":"/data/git/switchyard","remote":"origin","remote_commit":null,"repository":"switchyard","worktree_clean":true},{"branch":"campaign/governed-campaign-loop-v1-worker-vm","commit":"5c8b22b77193798f25298b02758ac3caa3a8fe24","discrepancy":"Campaign branch absent remotely.","path":"/data/git/ag_ng","remote":"origin","remote_commit":null,"repository":"ag_ng-glass-heron","worktree_clean":true},{"branch":"campaign/external-occurrence-authorization","commit":"4f36e9570d49f21e32e7f7b5f84e8055161ee12f","discrepancy":"Local clone origin points to operational clone; private remote verified separately.","path":"/tmp/ag-ng-agc","remote":"private-origin","remote_commit":"4f36e9570d49f21e32e7f7b5f84e8055161ee12f","repository":"ag_ng-authorization","worktree_clean":true},{"branch":"campaign/ag-exact-occurrence-authorization","commit":"5de6a3336f1556559ec8db5593a907f6493019e3","discrepancy":"Operational /data/git/codex is dirty and must not be used.","path":"/tmp/codex-agc","remote":"private-origin","remote_commit":"5de6a3336f1556559ec8db5593a907f6493019e3","repository":"codex-authorization","worktree_clean":true},{"branch":"campaign/governed-campaign-loop-v1-exact-endpoint","commit":"a838501de2fc220bfc838904733114e41124b744","discrepancy":"Campaign branch absent remotely.","path":"/data/git/porter","remote":"origin","remote_commit":null,"repository":"porter","worktree_clean":true},{"branch":"campaign/governed-campaign-loop-v1-worker-vm","commit":"0823f1b1b81e94512cca2bdf861ad74d64162aa1","discrepancy":"No authoritative remote.","path":"/data/git/campaign-driver-ng","remote":null,"remote_commit":null,"repository":"campaign-driver-ng","worktree_clean":true},{"branch":"campaign/passive-vm-release-reproducibility-and-lifecycle-v1","commit":"74127fc0a121a0408ce6b5262ddf22f5e2d6f839","discrepancy":"Linked worktree of shared nq-ng repository; campaign branch absent remotely.","path":"/data/git/nq-ng-caliper","remote":"origin","remote_commit":null,"repository":"nq-ng-caliper","worktree_clean":true},{"branch":"campaign/k3s-live-origin-capacity-qualification-v1","commit":"5fc7cc8212eb182bba54a2c92b7b37bd44b0cf69","discrepancy":"Linked worktree of shared nq-ng repository; campaign branch absent remotely.","path":"/data/git/nq-ng-bedrock","remote":"origin","remote_commit":null,"repository":"nq-ng-bedrock","worktree_clean":true},{"branch":"campaign/lanternwake-constellation-runtime-monitor-integration","commit":"aef117f7944288d5ccb130e1845ad3b23fdc6035","discrepancy":null,"path":"/data/git/.worktrees/nq-lanternwake-monitor-integration","remote":"origin","remote_commit":"aef117f7944288d5ccb130e1845ad3b23fdc6035","repository":"nq-classic-lanternwake","worktree_clean":true},{"branch":"main","commit":"59abd3bcb2d0cc30657a659b3ebc57b981289d9f","discrepancy":"Primary checkout is on unrelated branch 675e247 with pre-existing untracked campaign records; use isolated main worktree.","path":"/data/git/skunkworks/nq-ng","remote":"origin","remote_commit":"59abd3bcb2d0cc30657a659b3ebc57b981289d9f","repository":"nq-ng-canonical","worktree_clean":false},{"branch":"campaign/copper-lantern-same-version-reference-deployment","commit":"08b7dbe5b390b099b03a576d1f694c9d14438b05","discrepancy":null,"path":"/tmp/copper-lantern-civild","remote":"origin","remote_commit":"08b7dbe5b390b099b03a576d1f694c9d14438b05","repository":"civild-copper-lantern","worktree_clean":true},{"branch":"campaign/passive-linode-canonical-relation-relaunch-v1","commit":"460d97c01fedb507ffad090c46437a8d833f93e7","discrepancy":"Read-only until 2026-08-29T21:45:05Z; linked worktree of shared nq-ng repository.","path":"/data/git/nq-ng-glasshopper","remote":"origin","remote_commit":null,"repository":"nq-ng-glasshopper","worktree_clean":true}],"schema":"nightshift.orientation-packet/v1","source_evidence":[{"branch":"campaign/governed-campaign-loop-v0-qualification","commit":"999a91d92b56e655906a31a1a4e914ccaf1ecbfb","file_digest":"sha256:29f4b1f11565d26dd957831fe6b5fbd6efe0a4e50bfe4f87fbcd4fcc75a1be3f","path":"docs/CANONICAL_RUNTIME_C1.md","predecessor_classification":"CANONICAL_RUNTIME_CONTRACT","repository":"nightshift"},{"branch":"campaign/governed-campaign-loop-v1-worker-vm","commit":"5c8b22b77193798f25298b02758ac3caa3a8fe24","file_digest":"sha256:1c7121b6327eff19fb3fbe0310965f484313b0f5d84da2c52f7ff2bd5e674531","path":"qualification/governed-campaign-loop-v1/glass-heron/QUALIFICATION.md","predecessor_classification":"WORKER-VM-CUSTODY-NOT-BOUNDED","repository":"ag_ng"},{"branch":"campaign/passive-vm-release-reproducibility-and-lifecycle-v1","commit":"74127fc0a121a0408ce6b5262ddf22f5e2d6f839","file_digest":"sha256:f17afce9a05f357ae80f4a0e064d4f03ed05fa130837704c729be7f886a62bdb","path":"audit/receipts/run-2026-08-29-caliper-c3-vm-authority-lifecycle/REPORT.md","predecessor_classification":"PASSIVE-VM-AUTHORITY-LIFECYCLE-NOT-QUALIFIED","repository":"nq-ng"},{"branch":"campaign/k3s-live-origin-capacity-qualification-v1","commit":"5fc7cc8212eb182bba54a2c92b7b37bd44b0cf69","file_digest":"sha256:7ef0ca0e8ba859c4ffd7dadf80607aa25c6038f082bfa75a8988c60c35312fd7","path":"audit/receipts/run-2026-08-29-bedrock-first-live-occurrence-entry-gate/REPORT.md","predecessor_classification":"PASSIVE-K3S-AG-LIVE-OCCURRENCE-NOT-QUALIFIED","repository":"nq-ng"},{"branch":"campaign/lanternwake-constellation-runtime-monitor-integration","commit":"aef117f7944288d5ccb130e1845ad3b23fdc6035","file_digest":"sha256:f8d1669ceccd995ca6bc7e8fcbe87ac81599bb6d30e02b52fb25deebdd981db3","path":"docs/integration/lanternwake-constellation-runtime-monitor-integration/SUCCESSOR-HANDOFF.md","predecessor_classification":"MONITOR-INTEGRATION-LIVE-WITH-BOUNDED-BLIND-SPOTS","repository":"nq-classic"},{"branch":"campaign/copper-lantern-same-version-reference-deployment","commit":"08b7dbe5b390b099b03a576d1f694c9d14438b05","file_digest":"sha256:fd1aca8d50387a2f408f528aa831f2d9d242d3f43525ea0aa3b267245673231e","path":"research/state-transition/same-version-reference-deployment-operator-procedure/summary.md","predecessor_classification":"HIDDEN-BUILD-DEPENDENCY-FOUND","repository":"civild"},{"branch":"campaign/passive-linode-canonical-relation-relaunch-v1","commit":"460d97c01fedb507ffad090c46437a8d833f93e7","file_digest":"sha256:f0575552df2025effc47eead674aba6102472657b73a0fe8bc6ce7013f9b8fd3","path":"audit/receipts/run-2026-08-28-passive-linode-glasshopper-launch/OBSERVABILITY-HANDOFF.md","predecessor_classification":"READ_ONLY_ACTIVE_UNTIL_CLOSEOUT_BOUNDARY","repository":"nq-ng"},{"branch":"master","commit":"3f719451f2daca88bdb4e87e8e8142f22cc9df7d","file_digest":"sha256:5246e370c7fa6ef10a54856a2ba36663d7c7e762bc782c3e4acd7582c419b9d2","path":"README.md","predecessor_classification":"INTERLOCK-IMPLEMENTED-WITH-MAILBOX-BLOCK","repository":"switchyard"},{"branch":"campaign/external-occurrence-authorization","commit":"4f36e9570d49f21e32e7f7b5f84e8055161ee12f","file_digest":"sha256:5413774507